id,uuid,api_feed_id,source_name,source_uuid,title,description,context,source_url,image_url,author,published_at,symbols,sectors,industries,report,created_at,update_at,deleted_at
120,0e000e37-db8c-4b06-a564-97bf77ba1b63,2,Electrek,https://electrek.co/?p=350077,"Tesla dominated US EV registrations in 2023, but Rivian and Hyundai are catching on","<div class=""feat-image""><img src=""https://electrek.co/wp-content/uploads/sites/3/2024/02/US-EV-registrations-2023.jpeg?quality=82&#038;strip=all&#038;w=1400"" /></div><p>New EV registrations in the US were up 23% in December as adoption continues to grow. Although <a href=""https://electrek.co/guides/tesla/"">Tesla’s</a> 11% growth lagged behind the market, the automaker still dominated with 56% of US EV registrations in 2023. Meanwhile, several smaller players, including Hyundai and <a href=""https://electrek.co/guides/rivian/"">Rivian</a>, saw promising growth.</p>



 <a href=""https://electrek.co/2024/02/16/tesla-led-2023-us-ev-registrations-rivian-hyundai/#more-350077"" data-post-id=""350077"" data-layer-pagetype=""post"" data-layer-postcategory=""hyundai,rivian,tesla"" data-layer-viewtype=""unknown"" class=""more-link"">more…</a>","New EV registrations in the US were up 23% in December as adoption continues to grow. Although Tesla’s 11% growth lagged behind the market, the automaker still dominated with 56% of US EV registrations in 2023. Meanwhile, several smaller players, including Hyundai and Rivian, saw promising growth.",https://electrek.co/2024/02/16/tesla-led-2023-us-ev-registrations-rivian-hyundai/,https://electrek.co/wp-content/uploads/sites/3/2024/02/US-EV-registrations-2023.jpeg?quality=82&strip=all&w=1400,Peter Johnson,2024-02-16 18:34:04+00:00,"hyundai,rivian,tesla",,,FALSE,2024-02-21 23:29:54.821215+00:00,,
121,847619e6-3055-4647-92ff-681a553cdafc,2,Electrek,https://electrek.co/?p=350002,Is this Rivian’s more affordable R2 electric SUV spotted in the wild?,"<div class=""feat-image""><img src=""https://electrek.co/wp-content/uploads/sites/3/2024/02/image_490823.png?w=1276"" /></div><p>As we get closer to the official debut of <a href=""https://electrek.co/guides/rivian/"">Rivian’s</a> more affordable R2, we are finally getting a better idea of what to expect. After teasing the model for the first time yesterday, Rivian’s R2 was reportedly spotted filming in downtown LA shortly after.</p>



 <a href=""https://electrek.co/2024/02/16/rivians-affordable-r2-electric-suv-spotted/#more-350002"" data-post-id=""350002"" data-layer-pagetype=""post"" data-layer-postcategory=""rivian,rivian-r2"" data-layer-viewtype=""unknown"" class=""more-link"">more…</a>","As we get closer to the official debut of Rivian’s more affordable R2, we are finally getting a better idea of what to expect. After teasing the model for the first time yesterday, Rivian’s R2 was reportedly spotted filming in downtown LA shortly after.",https://electrek.co/2024/02/16/rivians-affordable-r2-electric-suv-spotted/,https://electrek.co/wp-content/uploads/sites/3/2024/02/image_490823.png?w=1276,Peter Johnson,2024-02-16 16:21:15+00:00,"rivian,rivian-r2",,,FALSE,2024-02-21 23:29:54.824723+00:00,,
122,19f556d0-5c31-4103-8d82-a0ba95d870bb,2,Electrek,https://electrek.co/?p=350003,BYD’s electric pickup truck is headed overseas,"<div class=""feat-image""><img src=""https://electrek.co/wp-content/uploads/sites/3/2024/02/BYD-electric-pickup-1.jpeg?quality=82&#038;strip=all&#038;w=1400"" /></div><p>Leading global EV maker <a href=""https://electrek.co/guides/byd/"">BYD’s</a> electric pickup was recently spotted testing in Australia, suggesting the new model could be launching overseas soon.</p>



 <a href=""https://electrek.co/2024/02/16/byd-electric-pickup-truck-headed-overseas/#more-350003"" data-post-id=""350003"" data-layer-pagetype=""post"" data-layer-postcategory=""byd"" data-layer-viewtype=""unknown"" class=""more-link"">more…</a>","Leading global EV maker BYD’s electric pickup was recently spotted testing in Australia, suggesting the new model could be launching overseas soon.",https://electrek.co/2024/02/16/byd-electric-pickup-truck-headed-overseas/,https://electrek.co/wp-content/uploads/sites/3/2024/02/BYD-electric-pickup-1.jpeg?quality=82&strip=all&w=1400,Peter Johnson,2024-02-16 15:36:10+00:00,byd,,,FALSE,2024-02-21 23:29:54.828459+00:00,,
123,45dcc335-af40-443b-84be-cb238fb80b97,2,Electrek,https://electrek.co/?p=350008,"Tesla offers to accelerate Cybertruck delivery with referral program, sold out in hours","<div class=""feat-image""><img src=""https://electrek.co/wp-content/uploads/sites/3/2023/12/Tesla-Cybertruck-race.jpeg?quality=82&#038;strip=all&#038;w=1400"" /></div><p>Tesla has offered Cybertruck reservation holders to accelerate their delivery through an award in its referral program. It sold out in hours.</p>



 <a href=""https://electrek.co/2024/02/16/tesla-offers-accelerate-cybertruck-delivery-referral-program-sold-out-in-hours/#more-350008"" data-post-id=""350008"" data-layer-pagetype=""post"" data-layer-postcategory=""tesla,tesla-cybertruck"" data-layer-viewtype=""unknown"" class=""more-link"">more…</a>",Tesla has offered Cybertruck reservation holders to accelerate their delivery through an award in its referral program. It sold out in hours.,https://electrek.co/2024/02/16/tesla-offers-accelerate-cybertruck-delivery-referral-program-sold-out-in-hours/,https://electrek.co/wp-content/uploads/sites/3/2023/12/Tesla-Cybertruck-race.jpeg?quality=82&strip=all&w=1400,Fred Lambert,2024-02-16 15:23:02+00:00,"tesla,tesla-cybertruck",,,FALSE,2024-02-21 23:29:54.833986+00:00,,
124,4d4adae0-0e3e-4148-8f03-92137b59219b,2,Electrek,https://electrek.co/?p=350004,This legacy automaker says it just turned a profit on EVs,"<div class=""feat-image""><img src=""https://electrek.co/wp-content/uploads/sites/3/2023/06/Fiat-top-selling-EV-US-6.jpeg?quality=82&#038;strip=all&#038;w=1280"" /></div><p>Jeep and Chrysler owner Stellantis – hardly a hero in our EV adoption story – says that it is finally turning a profit on EVs. But that’s in no part due to US sales, since the company doesn’t sell any EVs in the country – but that is changing with a lineup on its way this year.</p>



 <a href=""https://electrek.co/2024/02/16/this-legacy-automaker-says-it-just-turned-a-profit-on-evs/#more-350004"" data-post-id=""350004"" data-layer-pagetype=""post"" data-layer-postcategory=""stellantis"" data-layer-viewtype=""unknown"" class=""more-link"">more…</a>","Jeep and Chrysler owner Stellantis – hardly a hero in our EV adoption story – says that it is finally turning a profit on EVs. But that’s in no part due to US sales, since the company doesn’t sell any EVs in the country – but that is changing with a lineup on its way this year.",https://electrek.co/2024/02/16/this-legacy-automaker-says-it-just-turned-a-profit-on-evs/,https://electrek.co/wp-content/uploads/sites/3/2023/06/Fiat-top-selling-EV-US-6.jpeg?quality=82&strip=all&w=1280,Jennifer Mossalgue,2024-02-16 14:58:31+00:00,stellantis,,,FALSE,2024-02-21 23:29:54.837471+00:00,,
125,797fb8f0-0dea-4681-a79a-683b282a8b5f,2,Electrek,https://electrek.co/?p=349996,"Quick Charge Podcast: February 15, 2024","<div class=""feat-image""><img src=""https://electrek.co/wp-content/uploads/sites/3/2020/01/quick-charge-placeholder-lead-1.jpg?quality=82&#038;strip=all&#038;w=1600"" /></div><p>Listen to a recap of the top stories of the day from Electrek. Quick Charge is available now on <a href=""https://podcasts.apple.com/us/podcast/quick-charge/id1494750564"">Apple Podcasts</a>, <a href=""https://open.spotify.com/show/1fIpG4hB4lhGo0Iuygs1zJ?si=7FwqE-lHRnK_DXUCCZa8aw"">Spotify</a>, <a href=""https://tunein.com/podcasts/Technology-Podcasts/Quick-Charge-p1284966/"">TuneIn</a> and our<a href=""https://feedpress.me/quickcharge""> RSS feed</a> for Overcast and other podcast players.</p>



<figure class=""wp-block-audio""><audio controls src=""https://electrek.co/wp-content/uploads/sites/3/2024/02/Quick-Charge-2.15.24-2.mp3""></audio></figure>



 <a href=""https://electrek.co/2024/02/15/quick-charge-podcast-february-15-2024/#more-349996"" data-post-id=""349996"" data-layer-pagetype=""post"" data-layer-postcategory=""podcast,quick-charge"" data-layer-viewtype=""unknown"" class=""more-link"">more…</a>","Listen to a recap of the top stories of the day from Electrek. Quick Charge is available now on Apple Podcasts, Spotify, TuneIn and our RSS feed for Overcast and other podcast players.",https://electrek.co/2024/02/15/quick-charge-podcast-february-15-2024/,https://electrek.co/wp-content/uploads/sites/3/2020/01/quick-charge-placeholder-lead-1.jpg?quality=82&strip=all&w=1600,Mikey G,2024-02-16 03:45:02+00:00,"podcast,quick-charge",,,FALSE,2024-02-21 23:29:54.841407+00:00,,
126,9c9a8950-169b-4fd2-bfe0-7f255cbd85ce,2,Electrek,https://electrek.co/?p=349969,Chevy Blazer EV sales are still halted as GM looks to get back on track,"<div class=""feat-image""><img src=""https://electrek.co/wp-content/uploads/sites/3/2024/02/Chevy-Blazer-EV-sales.jpeg?quality=82&#038;strip=all&#038;w=1400"" /></div><p>Those looking to get their hands on GM’s highly anticipated Chevy Blazer EV may have to wait even longer. Sales of the new <a href=""https://electrek.co/guides/chevy-blazer-ev/"">Chevy Blazer EV</a> are still paused as GM looks to overcome software glitches setting the automaker back.</p>



 <a href=""https://electrek.co/2024/02/15/chevy-blazer-ev-sales-still-halted-gm-back-on-track/#more-349969"" data-post-id=""349969"" data-layer-pagetype=""post"" data-layer-postcategory=""chevy-blazer-ev,general-motors,gm"" data-layer-viewtype=""unknown"" class=""more-link"">more…</a>",Those looking to get their hands on GM’s highly anticipated Chevy Blazer EV may have to wait even longer. Sales of the new Chevy Blazer EV are still paused as GM looks to overcome software glitches setting the automaker back.,https://electrek.co/2024/02/15/chevy-blazer-ev-sales-still-halted-gm-back-on-track/,https://electrek.co/wp-content/uploads/sites/3/2024/02/Chevy-Blazer-EV-sales.jpeg?quality=82&strip=all&w=1400,Peter Johnson,2024-02-15 22:28:28+00:00,"chevy-blazer-ev,general-motors,gm",,,FALSE,2024-02-21 23:29:54.846771+00:00,,
127,9742e955-ea89-4f67-b9de-533b0bf9d9b0,2,Electrek,https://electrek.co/?p=349332,A massive US solar panel maker just went all in on panel recycling [update],"<div class=""feat-image""><img src=""https://electrek.co/wp-content/uploads/sites/3/2024/02/SOLARCYCLE-06.jpg?quality=82&#038;strip=all&#038;w=1600"" /></div><p>Solar panels made in the US’s largest silicon-based solar panel factory will now be recycled, thanks to a new partnership. </p>



 <a href=""https://electrek.co/2024/02/15/us-solar-panel-recycling-2/#more-349332"" data-post-id=""349332"" data-layer-pagetype=""post"" data-layer-postcategory=""egeb,energy-brief,georgia,solar,inflation-reduction-act,solar-power"" data-layer-viewtype=""unknown"" class=""more-link"">more…</a>","Solar panels made in the US’s largest silicon-based solar panel factory will now be recycled, thanks to a new partnership. ",https://electrek.co/2024/02/15/us-solar-panel-recycling-2/,https://electrek.co/wp-content/uploads/sites/3/2024/02/SOLARCYCLE-06.jpg?quality=82&strip=all&w=1600,Michelle Lewis,2024-02-15 22:25:25+00:00,"egeb,energy-brief,georgia,solar,inflation-reduction-act,solar-power",,,FALSE,2024-02-21 23:29:54.852471+00:00,,
128,677208b6-7661-40b3-885a-2b63ebe021c4,2,Electrek,https://electrek.co/?p=349968,"Tesla Cybertrucks are already rusting, but there’s an easy fix","<div class=""feat-image""><img src=""https://electrek.co/wp-content/uploads/sites/3/2024/02/Screenshot-2024-02-15-at-4.53.21-PM.jpg?quality=82&#038;strip=all&#038;w=1321"" /></div><p>Some early Tesla Cybertruck owners are reporting some rust spots on their brand-new stainless steel pickup trucks.</p>



<p>At this point, it’s entirely clear why it is happening, but we have a pretty good idea and an easy fix.</p>



 <a href=""https://electrek.co/2024/02/15/tesla-cybertrucks-already-rusting/#more-349968"" data-post-id=""349968"" data-layer-pagetype=""post"" data-layer-postcategory=""tesla,tesla-cybertruck"" data-layer-viewtype=""unknown"" class=""more-link"">more…</a>",Some early Tesla Cybertruck owners are reporting some rust spots on their brand-new stainless steel pickup trucks.,https://electrek.co/2024/02/15/tesla-cybertrucks-already-rusting/,https://electrek.co/wp-content/uploads/sites/3/2024/02/Screenshot-2024-02-15-at-4.53.21-PM.jpg?quality=82&strip=all&w=1321,Fred Lambert,2024-02-15 22:04:38+00:00,"tesla,tesla-cybertruck",,,FALSE,2024-02-21 23:29:54.858081+00:00,,
129,3dc083ea-2f32-4a27-8f2c-8590f70fbd23,2,Electrek,https://electrek.co/?p=349924,Solar + battery storage will make up 81% of new US electric generating capacity in 2024,"<div class=""feat-image""><img src=""https://electrek.co/wp-content/uploads/sites/3/2023/10/Solar-Sheep-Grazing_Solar_Dominion_Energy_01.jpg?quality=82&#038;strip=all&#038;w=1600"" /></div><p>The <a href=""https://www.eia.gov/"">US Energy Information Administration</a> (EIA) reports today that 62.8 gigawatts (GW) of new utility-scale electric generating capacity is coming online in 2024 – here’s how it breaks down.</p>



 <a href=""https://electrek.co/2024/02/15/us-solar-battery-storage-2024/#more-349924"" data-post-id=""349924"" data-layer-pagetype=""post"" data-layer-postcategory="""" data-layer-viewtype=""unknown"" class=""more-link"">more…</a>",The US Energy Information Administration (EIA) reports today that 62.8 gigawatts (GW) of new utility-scale electric generating capacity is coming online in 2024 – here’s how it breaks down.,https://electrek.co/2024/02/15/us-solar-battery-storage-2024/,https://electrek.co/wp-content/uploads/sites/3/2023/10/Solar-Sheep-Grazing_Solar_Dominion_Energy_01.jpg?quality=82&strip=all&w=1600,Michelle Lewis,2024-02-15 21:56:08+00:00,,,,FALSE,2024-02-21 23:29:54.861637+00:00,,
130,7b689cd0-27fb-4a3c-9b36-446fdd7c8b06,2,Electrek,https://electrek.co/?p=349935,"Even the ‘drill, baby, drill’ guys realize electric is the way to go!","<div class=""feat-image""><img src=""https://electrek.co/wp-content/uploads/sites/3/2024/02/sandviks-latest-battery-electric-concept-rig-pushes-boundaries-of-emission-free-surface-drilling-2.jpg?quality=82&#038;strip=all&#038;w=1600"" /></div><p>Swedish equipment brand Sandvik announced a new battery electric surface drill rig in a bid to create more efficient, cost-effective drilling operations. And, yes – the irony here is <em>delicious</em>!</p>



 <a href=""https://electrek.co/2024/02/15/even-the-drill-baby-drill-guys-realize-electric-is-the-way-to-go/#more-349935"" data-post-id=""349935"" data-layer-pagetype=""post"" data-layer-postcategory=""electric-construction-equipment,mining"" data-layer-viewtype=""unknown"" class=""more-link"">more…</a>","Swedish equipment brand Sandvik announced a new battery electric surface drill rig in a bid to create more efficient, cost-effective drilling operations. And, yes – the irony here is delicious!",https://electrek.co/2024/02/15/even-the-drill-baby-drill-guys-realize-electric-is-the-way-to-go/,https://electrek.co/wp-content/uploads/sites/3/2024/02/sandviks-latest-battery-electric-concept-rig-pushes-boundaries-of-emission-free-surface-drilling-2.jpg?quality=82&strip=all&w=1600,Jo Borrás,2024-02-15 21:47:15+00:00,"electric-construction-equipment,mining",,,FALSE,2024-02-21 23:29:54.865428+00:00,,
131,b923ad42-074f-48c9-b23a-b574433d9df5,2,Electrek,https://electrek.co/?p=349934,"South Korea’s new EV policy targets BYD, Tesla Model Y while favoring Hyundai and Kia","<div class=""feat-image""><img src=""https://electrek.co/wp-content/uploads/sites/3/2024/01/Hyundai-IONIQ-5-top-seller-1.jpeg?quality=82&#038;strip=all&#038;w=1400"" /></div><p>South Korea’s government looks to give domestic automakers <a href=""https://electrek.co/guides/hyundai/"">Hyundai</a> and Kia a break with its new EV policy. The new EV subsidy policy is in response to price cuts on <a href=""https://electrek.co/guides/tesla-model-y/"">Tesla’s Model Y</a> and BYD’s models, which use lower-cost LFP batteries. </p>



 <a href=""https://electrek.co/2024/02/15/koreas-ev-policy-targets-tesla-model-y-favors-hyundai/#more-349934"" data-post-id=""349934"" data-layer-pagetype=""post"" data-layer-postcategory=""hyundai,kia"" data-layer-viewtype=""unknown"" class=""more-link"">more…</a>","South Korea’s government looks to give domestic automakers Hyundai and Kia a break with its new EV policy. The new EV subsidy policy is in response to price cuts on Tesla’s Model Y and BYD’s models, which use lower-cost LFP batteries. ",https://electrek.co/2024/02/15/koreas-ev-policy-targets-tesla-model-y-favors-hyundai/,https://electrek.co/wp-content/uploads/sites/3/2024/01/Hyundai-IONIQ-5-top-seller-1.jpeg?quality=82&strip=all&w=1400,Peter Johnson,2024-02-15 20:36:51+00:00,"hyundai,kia",,,FALSE,2024-02-21 23:29:54.869230+00:00,,
132,90efdfb3-bc66-42c6-aab1-0cf67d3269b2,2,Electrek,https://electrek.co/?p=349795,Scout Motors breaks ground on US facility where it will build its all-electric off-road trucks,"<div class=""feat-image""><img src=""https://electrek.co/wp-content/uploads/sites/3/2024/02/Scout-trucks-Hero.jpg?quality=82&#038;strip=all&#038;w=1400"" /></div><p>Born again truck brand Scout Motors hit a significant milestone this morning, breaking ground in Blythewood, South Carolina, the site of its future US hub for electric truck production. We’re still a ways away from the public debut of <a href=""https://electrek.co/guides/scout/"">Scout’s</a> flagship model. Still, there’s a lot to be excited about, and the brand’s heritage is already garnering a loyal fanbase in full support of its all-electric transition.</p>



 <a href=""https://electrek.co/2024/02/15/scout-motors-breaks-ground-us-facility-build-all-electric-off-road-trucks-evs/#more-349795"" data-post-id=""349795"" data-layer-pagetype=""post"" data-layer-postcategory=""scout,scout-motors,south-carolina,volkswagen-group"" data-layer-viewtype=""unknown"" class=""more-link"">more…</a>","Born again truck brand Scout Motors hit a significant milestone this morning, breaking ground in Blythewood, South Carolina, the site of its future US hub for electric truck production. We’re still a ways away from the public debut of Scout’s flagship model. Still, there’s a lot to be excited about, and the brand’s heritage is already garnering a loyal fanbase in full support of its all-electric transition.",https://electrek.co/2024/02/15/scout-motors-breaks-ground-us-facility-build-all-electric-off-road-trucks-evs/,https://electrek.co/wp-content/uploads/sites/3/2024/02/Scout-trucks-Hero.jpg?quality=82&strip=all&w=1400,Scooter Doll,2024-02-15 19:59:30+00:00,"scout,scout-motors,south-carolina,volkswagen-group",,,FALSE,2024-02-21 23:29:54.873641+00:00,,
133,b345a799-9720-44a8-b2e5-5b5ea3e5b0e4,2,Electrek,https://electrek.co/?p=349819,Ford moves to more affordable EVs as it welcomes partners to take on low-cost Chinese rivals,"<div class=""feat-image""><img src=""https://electrek.co/wp-content/uploads/sites/3/2023/08/Ford-gas-models-EVs-1.jpeg?quality=82&#038;strip=all&#038;w=1400"" /></div><p>Ford is open to partnering with the competition on affordable EVS to get a leg up on Chinese EV makers. Jim Farley, <a href=""https://electrek.co/guides/ford/"">Ford’s</a> CEO, said if you cannot compete with the Chinese, “then 20% to 30%” of your revenue is at risk.</p>



 <a href=""https://electrek.co/2024/02/15/ford-affordable-evs-open-to-partnering/#more-349819"" data-post-id=""349819"" data-layer-pagetype=""post"" data-layer-postcategory=""ford"" data-layer-viewtype=""unknown"" class=""more-link"">more…</a>","Ford is open to partnering with the competition on affordable EVS to get a leg up on Chinese EV makers. Jim Farley, Ford’s CEO, said if you cannot compete with the Chinese, “then 20% to 30%” of your revenue is at risk.",https://electrek.co/2024/02/15/ford-affordable-evs-open-to-partnering/,https://electrek.co/wp-content/uploads/sites/3/2023/08/Ford-gas-models-EVs-1.jpeg?quality=82&strip=all&w=1400,Peter Johnson,2024-02-15 19:02:58+00:00,ford,,,FALSE,2024-02-21 23:29:54.879388+00:00,,
134,723930ba-250f-48ca-a56c-bf7391af2912,2,Electrek,https://electrek.co/?p=349911,"Save 15% on Priority e-bikes, Goal Zero 1500X power station now $1,260, and more","<div class=""feat-image""><img src=""https://electrek.co/wp-content/uploads/sites/3/2023/11/priority-current-shimano-ebike-14.jpg?quality=82&#038;strip=all&#038;w=1400"" /></div><p>Headlining today’s top deals is the <a href=""https://9to5toys.com/2024/02/15/prioritys-limited-time-sale-takes-15-off-e-bikes-with-over-50-mile-range-starting-from-1444-2/"">limited-time Valentine’s sale</a> that is still taking <a href=""https://9to5toys.com/2024/02/15/prioritys-limited-time-sale-takes-15-off-e-bikes-with-over-50-mile-range-starting-from-1444-2/"">15% off Priority Bicycles’ three e-bike models starting from $1,444</a>. It is joined by a few discounts on Goal Zero power stations and bundles, led by the <a href=""https://9to5toys.com/2024/02/15/goal-zeros-yeti-1500x-power-station-offers-1516wh-capacity-and-10-ports-for-1260-low/"">Yeti 1500X Portable Power Station at $1,260</a>, as well as the <a href=""https://9to5toys.com/2024/02/15/worxs-20v-5-inch-cordless-electric-pruning-saw-promotes-garden-growth-for-100-reg-160/"">WORX 20V 5-inch Cordless Electric Pruning Saw for $100</a>. Plus, all of today’s other best new Green Deals. </p>



<p>Head below for other New Green Deals we’ve found today and, of course, <a href=""https://electrek.co/best-electric-vehicle-prices/""><em>Electrek</em>’s best EV buying </a>and <a href=""https://electrek.co/best-electric-vehicle-leases/"">leasing deals</a>. Also, check out the new <a href=""https://electrek.co/shop/""><em>Electrek</em> Tesla Shop for the best deals on Tesla accessories</a>.</p>



 <a href=""https://electrek.co/2024/02/15/priority-e-bikes-goal-zero-1500x-power-stations-more/#more-349911"" data-post-id=""349911"" data-layer-pagetype=""post"" data-layer-postcategory=""green-deals"" data-layer-viewtype=""unknown"" class=""more-link"">more…</a>","Headlining today’s top deals is the limited-time Valentine’s sale that is still taking 15% off Priority Bicycles’ three e-bike models starting from $1,444. It is joined by a few discounts on Goal Zero power stations and bundles, led by the Yeti 1500X Portable Power Station at $1,260, as well as the WORX 20V 5-inch Cordless Electric Pruning Saw for $100. Plus, all of today’s other best new Green Deals. ",https://electrek.co/2024/02/15/priority-e-bikes-goal-zero-1500x-power-stations-more/,https://electrek.co/wp-content/uploads/sites/3/2023/11/priority-current-shimano-ebike-14.jpg?quality=82&strip=all&w=1400,Reinette LeJeune,2024-02-15 19:00:41+00:00,green-deals,,,FALSE,2024-02-21 23:29:54.883521+00:00,,
135,0e3e62bd-0f1a-4d2b-998f-7e9f8171db26,2,Electrek,https://electrek.co/?p=349860,Tesla Model 3 has a new tech that ‘isolates shake frequencies in your belly’,"<div class=""feat-image""><img src=""https://electrek.co/wp-content/uploads/sites/3/2024/02/Tesla-Model-3-red-hero.jpg?quality=82&#038;strip=all&#038;w=1600"" /></div><p>The new refreshed Tesla Model 3 has a new technology that “isolates shake frequencies in your belly”. Yes, that’s apparently a thing now.</p>



 <a href=""https://electrek.co/2024/02/15/tesla-model-3-tech-isolates-shake-frequencies-in-your-belly/#more-349860"" data-post-id=""349860"" data-layer-pagetype=""post"" data-layer-postcategory=""tesla,tesla-model-3"" data-layer-viewtype=""unknown"" class=""more-link"">more…</a>","The new refreshed Tesla Model 3 has a new technology that “isolates shake frequencies in your belly”. Yes, that’s apparently a thing now.",https://electrek.co/2024/02/15/tesla-model-3-tech-isolates-shake-frequencies-in-your-belly/,https://electrek.co/wp-content/uploads/sites/3/2024/02/Tesla-Model-3-red-hero.jpg?quality=82&strip=all&w=1600,Fred Lambert,2024-02-15 18:22:41+00:00,"tesla,tesla-model-3",,,FALSE,2024-02-21 23:29:54.887127+00:00,,
136,e0e56576-dd06-41d8-88a8-ba45a3b235e1,2,Electrek,https://electrek.co/?p=349484,Top picks for the best looking Tesla Model Y and Model 3 wheel covers [Save 10%],"<div class=""feat-image""><img src=""https://electrek.co/wp-content/uploads/sites/3/2024/02/Cover-Photo-1.jpg?quality=82&#038;strip=all&#038;w=1600"" /></div><p>Want to zhuzh up your Tesla Model 3 or Model Y? US-based <a href=""https://bit.ly/3iCk5ce"">Tesloid</a>‘s wheel covers turn heads while protecting your rims. Plus, <em>Electrek</em> readers exclusively save 10% with promo code <strong>WHEELCOVERS</strong>. </p>



 <a href=""https://electrek.co/2024/02/15/tesla-model-y-model-3-wheel-covers-save-10/#more-349484"" data-post-id=""349484"" data-layer-pagetype=""post"" data-layer-postcategory=""sponsored-post,tesloid"" data-layer-viewtype=""unknown"" class=""more-link"">more…</a>","Want to zhuzh up your Tesla Model 3 or Model Y? US-based Tesloid‘s wheel covers turn heads while protecting your rims. Plus, Electrek readers exclusively save 10% with promo code WHEELCOVERS. ",https://electrek.co/2024/02/15/tesla-model-y-model-3-wheel-covers-save-10/,https://electrek.co/wp-content/uploads/sites/3/2024/02/Cover-Photo-1.jpg?quality=82&strip=all&w=1600,Sponsored Post,2024-02-15 18:22:38+00:00,"sponsored-post,tesloid",,,FALSE,2024-02-21 23:29:54.890958+00:00,,
