id,uuid,api_feed_id,source_name,source_uuid,title,description,context,source_url,image_url,author,published_at,symbols,sectors,industries,report,created_at,update_at,deleted_at
1,468fcb7e-51ba-4cb1-ba0a-bad036a46ecc,1,InsideEVs,https://insideevs.com/news/708867/scout-motors-buttons-interview/,Scout Motors' Electric Trucks Will Have Real Buttons,"Finally, an EV that doesn't want to dominate your life with screens. ","When Scout Motors' first electric trucks and SUVs roll off the assembly line in 2026, they will attempt to conquer the American market in ways that parent company Volkswagen has never been able to pull off before. And they will do this with something that's an increasing rarity in the growing electric market: actual, physical buttons.",https://insideevs.com/news/708867/scout-motors-buttons-interview/,https://cdn.motor1.com/images/mgl/AkgoVy/s6/scout-buttons-top.jpg,Patrick George,2024-02-15 23:24:49+00:00,,,,FALSE,2024-02-16 02:06:24.226765+00:00,,
2,38d514cb-af87-4bf2-bc1e-23ac40bae24f,1,InsideEVs,https://insideevs.com/news/708850/toyota-bz4x-depreciation-story/,The Toyota bZ4X Is Depreciating Massively. But Why?,We spoke with two automotive experts to find out what's going on with the e-TNGA EV prices. ,"Toyota and Subaru products have some of the best resale values of any mass-market cars. In the luxury world, Lexus vehicles hold onto their values better than products from Mercedes-Benz, BMW, Audi, and others. But while that holds for internal-combustion cars, the depreciation curve is different for the brands’ early electric efforts. The Toyota bZ4X, Subaru Solterra, and Lexus RZ all lie within that category.",https://insideevs.com/news/708850/toyota-bz4x-depreciation-story/,https://cdn.motor1.com/images/mgl/zx4OgE/s6/toyota-bz4x.jpg,Andrew Lambrecht,2024-02-15 22:00:01+00:00,,,,FALSE,2024-02-16 02:06:24.523811+00:00,,
3,cf0164bd-e19c-4b71-9303-65ca860f1e4b,1,InsideEVs,https://insideevs.com/news/708856/ford-small-car-evs-profitable/,"Ford Killed Its Small Cars. Now It Says Small, Profitable EVs Are A Must",Ford doubled-down on trucks and SUVs. Now it's realizing smaller might be better.,"If you've been interested in a smaller vehicle from the Ford Motor Company—say, a Focus or a Fiesta or a Fusion, something like that—you've unfortunately been out of luck for years now. Back in 2018, when gas was extra cheap, interest rates were low and no high-tech Chinese automakers were posting up in Mexico and waiting to pounce, Ford made a certain strategic decision to maximize profits. Under then-CEO Jim Hackett, Ford famously killed all of its cars in North America except the Mustang and Ford Focus Active, which was later canceled as well.",https://insideevs.com/news/708856/ford-small-car-evs-profitable/,https://cdn.motor1.com/images/mgl/0eNM0k/s6/ford-small-ev-top.jpg,Patrick George,2024-02-15 21:00:38+00:00,,,,FALSE,2024-02-16 02:06:24.807494+00:00,,
4,b70fd4ac-206b-47fb-8bce-d3e3b1ddc407,1,InsideEVs,https://insideevs.com/news/708232/volvo-trucks-first-electric-only-model/,This Is Volvo Trucks’ First Electric-Only Model: FM Low Entry,An all-electric truck ready for heavy loads and efficient driving in city areas. ,"Volvo Trucks moves forward with the electrification of its truck lineup, introducing another (its eighth) all-electric truck model.",https://insideevs.com/news/708232/volvo-trucks-first-electric-only-model/,https://cdn.motor1.com/images/mgl/YAGMge/s6/volvo-fm-low-entry.jpg,Mark Kane,2024-02-15 20:00:49+00:00,,,,FALSE,2024-02-16 02:06:25.096815+00:00,,
5,db2bdd5c-7cd0-489c-bc0f-73d7a0b2711a,1,InsideEVs,https://insideevs.com/news/708805/ex-gm-truck-exec-tesla-cybertruck/,Ex-GM Truck Exec On The Tesla Cybertruck: Make It Cheaper And More People Will Want It,Terry Woychowski was the Chief Engineer for GM’s Full-Size Truck Platform in the 2000s. Think Chevy Silverado and the original Hummer.,"The Tesla Cybertruck is arguably the most controversial pickup in recent history, with its angular design, stainless steel body panels, and bold claims about capability. Ever since it was revealed in 2019, people argued whether or not Tesla’s first-ever truck can actually do truck things.",https://insideevs.com/news/708805/ex-gm-truck-exec-tesla-cybertruck/,https://cdn.motor1.com/images/mgl/Akgo02/s6/tesla-cybertruck-owner-review.jpg,Iulian Dnistran,2024-02-15 19:00:25+00:00,,,,FALSE,2024-02-16 02:06:25.469720+00:00,,
6,3aee2b64-7948-45bc-84a0-a9476edcf8aa,1,InsideEVs,https://insideevs.com/news/708836/rivian-r2-teaser-released/,Rivian R2: Here's A Shadowy First Look,Surprise! It looks like a Rivian.,"Earlier this month, Rivian announced that its highly anticipated R2 model, potentially a mid-size SUV or crossover, was set to be unveiled on March 7, 2024. Leading up to the unveiling event next month at the Laguna Beach showroom in Orange County, California, Rivian is stoking enthusiasts' curiosity with the release of the R2's first official teaser.",https://insideevs.com/news/708836/rivian-r2-teaser-released/,https://cdn.motor1.com/images/mgl/7ZvO8o/s6/rivian-r2-teaser.jpg,Suvrat Kothari,2024-02-15 17:17:07+00:00,,,,FALSE,2024-02-16 02:06:25.743752+00:00,,
7,f33e5855-b129-4578-a2f2-82728258cae0,1,InsideEVs,https://insideevs.com/news/708783/gm-super-cruise-update-2024/,"GM’s Super Cruise Now Works On 750,000 Miles Of Roads",The update nearly doubles the number of highway miles in North America where users can drive hands-free.,"Super Cruise, General Motors’ advanced driver-assistance system (ADAS), is getting a big update that will almost double the number of highway miles where owners of compatible cars can activate the feature.",https://insideevs.com/news/708783/gm-super-cruise-update-2024/,https://cdn.motor1.com/images/mgl/Kb1N2b/s6/gm-super-cruise-on-a-cadillac-escalade-iq.jpg,Iulian Dnistran,2024-02-15 16:13:32+00:00,,,,FALSE,2024-02-16 02:06:26.022650+00:00,2024-02-16 17:13:10.726202+00:00,
8,8fcd5d29-b4f6-4a87-9995-d057149773bc,1,InsideEVs,https://insideevs.com/news/708798/sacramento-california-gas-critical-materials/,Sacramento Looks to Ban New Gas Stations,"Plus, Ford calls Chinese EVs a ""colossal"" threat and the U.S. issued $135 Million in EV tax credits so far in 2024.","Spring is just a month away, and that means&nbsp;out with the old, in with the new. Apparently Sacramento, California feels that way too, but about its vehicle support infrastructure. The Golden State's capital city may soon become one of the major cities aiming to ban the construction or expansion of gas stations.",https://insideevs.com/news/708798/sacramento-california-gas-critical-materials/,https://cdn.motor1.com/images/mgl/3Wv9Jj/s6/sacramento-gas-station-ban---critical-materials-20240215.jpg,Rob Stumpf,2024-02-15 16:13:02+00:00,,,,FALSE,2024-02-16 02:06:26.300300+00:00,,
9,9840ba71-de87-4fe7-b658-90cd7e6e8ba3,1,InsideEVs,https://insideevs.com/news/708727/kia-ev9-owner-review-consumer-reports-video/,"Kia EV9 Has Ample Room Inside And Decent Handling, Says Consumer Reports",CR’s early owner’s review of the electric three-row SUV also points out some annoying things.,"The Kia EV9 is kind of the all-electric equivalent of the Telluride. The pair of three-row SUVs are almost identical in size, but the fact that the EV9 has an all-electric powertrain has several advantages over its combustion-powered stablemate. However, there are some things in the zero-emissions SUV that might annoy owners.",https://insideevs.com/news/708727/kia-ev9-owner-review-consumer-reports-video/,https://cdn.motor1.com/images/mgl/nAmJM1/s6/nkh7xbtw_oc.jpg,Iulian Dnistran,2024-02-15 16:00:12+00:00,,,,FALSE,2024-02-16 02:06:26.638018+00:00,,
10,4b06d9aa-6bc5-4f44-bee3-84a540213da5,1,InsideEVs,https://insideevs.com/news/708546/how-to-clean-tesla-cybertruck-stainless-steel-body/,Tesla Cybertruck Owners Report 'Rust Spots.' Here's How To Remove Them,"You might even have these rather cheap products at home right now, which makes the task even easier.","The Tesla Cybertruck's stainless steel body panels get dirty, discolored and show signs of ""corrosion,"" but there's a simple two-step cheap method to fix these issues.",https://insideevs.com/news/708546/how-to-clean-tesla-cybertruck-stainless-steel-body/,https://cdn.motor1.com/images/mgl/nAmYRR/s6/p9gc4yjpsf4.jpg,Eric Loveday,2024-02-15 15:00:16+00:00,,,,FALSE,2024-02-16 02:06:26.918720+00:00,,
11,d9c843ff-b6c0-409a-8810-bbbd14324a32,1,InsideEVs,https://insideevs.com/news/708712/lucid-air-pure-price-cut/,"The Lucid Air Pure Just Got A $7,500 Price Cut","It may not qualify for a $7,500 credit from the federal government, but Lucid's covering the gap.","The Lucid Air Pure is too expensive to qualify for the revised $7500 federal tax credit. The price cap for qualifying sedans is $55,000, and the Lucid Air Pure RWD model started at $77,400. But Lucid announced a price cut Thursday, dropping the entrance cost of the luxury sedan to $69,900.",https://insideevs.com/news/708712/lucid-air-pure-price-cut/,https://cdn.motor1.com/images/mgl/wlp6Km/s6/2024-lucid-air-pure-rwd.jpg,Mack Hogan,2024-02-15 14:00:00+00:00,,,,FALSE,2024-02-16 02:06:27.202760+00:00,,
12,e2b40f0b-81f4-4191-b7ea-c0f21ef620c8,1,InsideEVs,https://insideevs.com/news/708706/2024-lancia-ypsilon-ev/,The 2024 Ypsilon Is Lancia's First New Car In 13 Years,The troubled Italian brand signals rebirth with its first-ever EV.,"We never thought this day would ever come again, but here is a new Lancia. Stellantis has pledged to keep all 14 (fourteen!) brands in its vast portfolio following the FCA-PSA merger. That means the Italian marque is getting a new chance to repair its severely damaged brand image. The 2024 Ypsilon kicks off a long overdue rebirth.",https://insideevs.com/news/708706/2024-lancia-ypsilon-ev/,https://cdn.motor1.com/images/mgl/7Zvxp6/s6/lancia-ypsilon-edizione-limitata-cassina-2024.jpg,Adrian Padeanu,2024-02-14 21:30:56+00:00,,,,FALSE,2024-02-16 02:06:27.478662+00:00,,
13,95cc3846-dd06-44ca-a0f9-6ceb636d2944,1,InsideEVs,https://insideevs.com/news/708703/france-electric-car-100-leasing-program/,French Government's €100-A-Month EV Leasing Plan Falls Victim To Its Own Success,Demand far outstripped supply after an affordable EV leasing program received an overwhelming response.,"In December 2023, the French government kicked off an ambitious program to encourage low-income households to buy electric cars and to broaden the appeal of EVs.&nbsp;",https://insideevs.com/news/708703/france-electric-car-100-leasing-program/,https://cdn.motor1.com/images/mgl/L3jQxW/s6/renault-scenic-e-tech-electric.jpg,Suvrat Kothari,2024-02-14 20:41:50+00:00,,,,FALSE,2024-02-16 02:06:27.748502+00:00,,
14,ff48b47f-a74f-4e49-b1f1-e7047fa21d0f,1,InsideEVs,https://insideevs.com/news/708689/tesla-model3-lr-more-expensive/,Tesla Model 3 Long Range Gets Second Price Hike This Month,And you'll have to wait longer to get it.,Tesla has increased the price of the Tesla Model 3 Long Range AWD by $500. It's the second time Tesla has hiked the Long Range's price this month.,https://insideevs.com/news/708689/tesla-model3-lr-more-expensive/,https://cdn.motor1.com/images/mgl/zxQYRq/s6/2024-tesla-model-3-highland.jpg,Mark Kane,2024-02-14 19:34:28+00:00,,,,FALSE,2024-02-16 02:06:28.080346+00:00,,
15,556f8b30-7a5d-4928-a928-e264adfaff14,1,InsideEVs,https://insideevs.com/features/708584/vw-first-ev-elektro-bus-battery-swap/,"Volkswagen’s First EV Came 50 Years Before The ID. Buzz, Battery Swapping Included",A fleet of converted T2 vans was created in the 1970s to explore alternative energy sources.,"The Volkswagen ID. Buzz is the German carmaker’s first mass-produced all-electric minivan, and it’s a pretty cool, modern nod to VW’s first-ever van–the iconic Type 2 Microbus, also known as the T1.",https://insideevs.com/features/708584/vw-first-ev-elektro-bus-battery-swap/,https://cdn.motor1.com/images/mgl/W8GOO3/s6/volkswagen-t2-elektro-bus.jpg,Iulian Dnistran,2024-02-14 16:00:23+00:00,,,,FALSE,2024-02-16 02:06:28.368873+00:00,,
16,1c476a38-5416-4844-9b16-dcad6e837ac6,1,InsideEVs,https://insideevs.com/news/708661/consumer-reports-electric-vehicle-experience/,"Lack Of Exposure, Experience Is Also Hurting EV Sales: Consumer Reports","Also on tap: Chrysler's new concept touts advanced but MIA battery tech, and yes, the Sony-Honda Afeela deal is still happening. ","I think every electric vehicle owner has had that ""a-ha"" moment; that instance when you just sort of get how everything works, when fear gives way to excitement about the advantages of moving on from gasoline, when everything clicks. Sometimes that happens behind the wheel. Other times, it happens when someone you know and trust can show you the way. ",https://insideevs.com/news/708661/consumer-reports-electric-vehicle-experience/,https://cdn.motor1.com/images/mgl/wlpY3V/s6/critical-materials-hyundai-ioniq-6.jpg,Patrick George,2024-02-14 15:31:27+00:00,,,,FALSE,2024-02-16 02:06:28.650467+00:00,,
17,2c1628e2-0bb7-4413-b2a2-9cbec51c258f,1,InsideEVs,https://insideevs.com/news/708385/chademo-adapter-youtube-safety/,"There's A CHAdeMO To CCS Adapter, But I'm Not Sure I'd Use It","A Finnish YouTuber has an adapter that allows his CHAdeMO-equipped Nissan Leaf to charge at CCS DC fast-charging stations, but the CHAdeMO association isn't sure if this is safe. ","God bless CHAdeMO. It was the DC fast-charging plug shape that was poised to win the charger format wars, purely by being installed on the only EVs capable of fast charging in their day, the Nissan Leaf and Mitsubishi i-MiEV. Alas, it didn’t succeed. Most DC fast charging stations are now CCS only and will soon pivot to NACS. Most fast charging service providers have also announced that they’ll be sunsetting support for the CHAdeMO. Yet, the lack of support for CHAdeMO is a serious issue. Nissan still sells a brand new Leaf that can only DC fast charge via a CHAdeMO connector. In a CCS and NACS world, what does that mean for Leaf owners who want to fast charge?",https://insideevs.com/news/708385/chademo-adapter-youtube-safety/,https://cdn.motor1.com/images/mgl/3WvKrX/s6/chademo-youtube-dala-topshot.jpg,Kevin Williams,2024-02-14 15:00:53+00:00,,,,FALSE,2024-02-16 02:06:28.930940+00:00,,
18,4af5ba8c-efcd-488f-80a0-77abec9ab123,1,InsideEVs,https://insideevs.com/news/708566/porsche-electric-minivan-very-interesting-design-boss/,"A Porsche Luxury Electric Minivan Would Be “Very Interesting,” Says Design Boss",Ferrari made an SUV and now Porsche is thinking about making an electric minivan. Has the world gone crazy?,"Porsche made everybody mad when it introduced the first-generation Cayenne two decades ago, only to rake in profits from it and become bigger and better than ever. But the Cayenne–and the even more successful Macan that followed–are SUVs, and everybody knows SUVs are the silver bullet in today’s car market.",https://insideevs.com/news/708566/porsche-electric-minivan-very-interesting-design-boss/,https://cdn.motor1.com/images/mgl/yrp1k/s6/porsche-vision-renndients-electric-concept-interior-2.jpg,Iulian Dnistran,2024-02-14 14:00:04+00:00,,,,FALSE,2024-02-16 02:06:29.266546+00:00,,
19,62d086ed-8f0b-42b5-a0c8-c92a0aa84842,1,InsideEVs,https://insideevs.com/reviews/708872/lucid-gravity-walkaround-review/,The Lucid Gravity Team Offers A Detailed Walkaround Overview,We get the inside scoop on the upcoming electric SUV's design and UX details.,"Lucid Motors second offering, an electric SUV called Gravity, is expected to begin shipping to customers by the end of 2024. ",https://insideevs.com/reviews/708872/lucid-gravity-walkaround-review/,https://cdn.motor1.com/images/mgl/9my0vb/s6/lucid-gravity-at-the-beach.jpg,Tom Moloughney,2024-02-16 17:02:40+00:00,,,,FALSE,2024-02-16 17:13:06.888060+00:00,,
20,164731d0-6043-472e-89a1-4f888389ac13,1,InsideEVs,https://insideevs.com/news/708951/gm-ev-push-guided-by-the-consumer/,GM Wants To Go EV-Only By 2035. Its CEO Says The Push Will ‘Be Guided By The Consumer’,"2024 is “the year of execution” for GM, CEO Marry Barra said.","This year, General Motors will have to prove that it’s capable of ramping up production of its Ultium-based electric vehicle portfolio, which includes names like the Cadillac Lyriq, Chevrolet Equinox EV, and GMC Hummer EV.",https://insideevs.com/news/708951/gm-ev-push-guided-by-the-consumer/,https://cdn.motor1.com/images/mgl/jlxnw1/s6/gm-ceo-mary-barra-with-the-2024-chevrolet-equinox-ev.jpg,Iulian Dnistran,2024-02-16 16:01:58+00:00,,,,FALSE,2024-02-16 17:13:07.177123+00:00,,
21,9a127a64-2eb6-4848-81a8-2113323bca72,1,InsideEVs,https://insideevs.com/features/708665/ten-reasons-to-buy-electric-car/,10 Reasons To Consider An Electric Car In 2024,"For starters, the available electric vehicles continue to grow on almost a weekly basis.","Electric vehicle ownership is no longer the niche, climate-saving activity it once was and has entered the mainstream, with many previous skeptics fully jumping on board. Even so, there are plenty of people, both current owners and others, who (rightfully) feel that the situation needs to be explained further.",https://insideevs.com/features/708665/ten-reasons-to-buy-electric-car/,https://cdn.motor1.com/images/mgl/0eNlvn/s6/ev-101-vw-id.4.jpg,Chris Teague,2024-02-16 15:28:46+00:00,,,,FALSE,2024-02-16 17:13:07.475720+00:00,,
22,6eaeea44-e0a6-427c-b524-a6f8e01074cb,1,InsideEVs,https://insideevs.com/news/708862/lges-4680type-batteries-coming-soon/,LG Energy Solution's 4680-Type Batteries Are Coming 'Soon',Series production will first begin in South Korea. The new plant in Arizona will follow.,"LG Energy Solution (LGES), one of the world's largest manufacturers of lithium-ion batteries for EVs, is expected to soon launch new high-capacity cylindrical battery cells.",https://insideevs.com/news/708862/lges-4680type-batteries-coming-soon/,https://cdn.motor1.com/images/mgl/1mK19/s6/tesla-battery-cells-from-left-1865-2170-and-4680.jpg,Mark Kane,2024-02-16 14:30:57+00:00,,,,FALSE,2024-02-16 17:13:07.755465+00:00,,
23,af170ce7-2c2e-4cae-9d77-9d82f3c18ab1,1,InsideEVs,https://insideevs.com/features/708852/podcast-tesla-rust-hyundai-ioniq-5-n/,"Rusty Tesla Cybertrucks, And Why The Hyundai Ioniq 5 N Is So Special","Plus we talk about Porsche's ""very interesting"" luxury electric minivan.","InsideEVs&nbsp;is proud to present episode 198 of its weekly podcast.&nbsp;Available on the&nbsp;InsideEVs&nbsp;YouTube channel&nbsp;and all major podcast platforms&nbsp;–&nbsp;Apple Podcasts,&nbsp;Spotify,&nbsp;Google Podcasts,&nbsp;iHeart Radio, and&nbsp;Tune In.&nbsp;We also stream the show live on&nbsp;Facebook,&nbsp;Twitch,&nbsp;Twitter, and YouTube on Friday at 9:30 AM EST.",https://insideevs.com/features/708852/podcast-tesla-rust-hyundai-ioniq-5-n/,https://cdn.motor1.com/images/mgl/1ZQbWq/s6/oauusj1q_rs.jpg,Eric Loveday,2024-02-16 13:30:47+00:00,,,,FALSE,2024-02-16 17:13:08.102754+00:00,,
24,a045d7de-3e44-491e-b010-a0fb4d21b637,1,InsideEVs,https://insideevs.com/news/708894/rivian-r2-suv-spy-photos-leak/,Rivian R2: Is This It?,"The company’s new, smaller, and more affordable EV will debut on March 7.","Images of what appears to be the all-new Rivian R2 SUV have made their way online ahead of the EV’s official debut on March 7. The Californian startup’s third model will arguably be its most important product, carrying a price tag of around $40,000 to $60,000.",https://insideevs.com/news/708894/rivian-r2-suv-spy-photos-leak/,https://cdn.motor1.com/images/mgl/2NLP1E/s6/rivian-r2-suv-spy-photos.jpg,Iulian Dnistran,2024-02-16 13:22:23+00:00,,,,FALSE,2024-02-16 17:13:08.384756+00:00,,
25,01a3f305-47d9-47f8-bf8a-03a56bd9d177,1,InsideEVs,https://insideevs.com/news/708787/plugin-car-sales-germany-january2024/,Plug-In Car Sales In Germany Rebound In January 2024,"However, the results are still lower than two years ago.","In January, new passenger car registrations in Germany amounted to 213,553, up 19% year-over-year. That's the best January since 2020 (246,300).",https://insideevs.com/news/708787/plugin-car-sales-germany-january2024/,https://cdn.motor1.com/images/mgl/9myop1/s6/tesla-model-y.jpg,Mark Kane,2024-02-16 13:00:53+00:00,,,,FALSE,2024-02-16 17:13:08.666347+00:00,,
26,8ddcf8c9-fd3c-43a2-99d7-46e53d8a732f,1,InsideEVs,https://insideevs.com/news/708999/scout-motors-ev-price/,"Scout Motors Electric Truck Could Be In High $40,000 Range, No Plans For Hybrid: CEO","It may be more expensive than the $40,000 price point that was tossed around, but the Volkswagen Group has big plans for Scout Motors.","When the Volkswagen Group unleashes the first Scout Motors electric trucks and SUVs in 2026, those vehicles will aim for the heart of America like no Golf or Tiguan could ever do. The Scouts are said to be rugged, ""heritage-inspired"" EVs that pay homage to one of the godfathers of the off-roading world. Given how popular retro SUVs like the Ford Bronco and Land Rover Defender are, the brand seems poised to be a hit—if the specs and price are right. ",https://insideevs.com/news/708999/scout-motors-ev-price/,https://cdn.motor1.com/images/mgl/wlpYxG/s6/scout-motors-teaser-top.jpg,Patrick George,2024-02-16 17:43:34+00:00,,,,FALSE,2024-02-16 18:11:13.187003+00:00,,
27,475711f2-297c-4fcb-ad46-64abe7ab6cba,1,InsideEVs,https://insideevs.com/news/709004/auto-software-tesla-gm-volkswagen/,Tesla Sparked A Car Software War. It’s Not Going So Hot,Carmakers are laser-focused on transforming into tech companies. Getting there is proving harder than expected. ,"In late 2012, a young upstart car company called Tesla Motors beamed out a software update to its earliest sedans. When tethered to a WiFi or 3G internet connection, Model S owners could download a tweak to their music player and some other features. It was a minor change, but one with profound reverberations that continue to this day. ",https://insideevs.com/news/709004/auto-software-tesla-gm-volkswagen/,https://cdn.motor1.com/images/mgl/E6WJBq/s6/car-crash-top-4.jpg,Tim Levin,2024-02-16 18:15:55+00:00,,,,FALSE,2024-02-16 18:16:11.208072+00:00,,
28,043d146f-830d-4a31-8243-7407c1fa0e01,1,InsideEVs,https://insideevs.com/news/709592/rivian-layoffs-2024/,Rivian Lays Off Another 10% Of Salaried Staff,"The EV startup said it faces ""economic and geopolitical uncertainties"" throughout 2024. ","Rivian is laying off 10% of its salaried workforce, the EV startup announced on Wednesday as it reported fourth-quarter and full-year earnings. It's the company's second round of layoffs in the past year. ",https://insideevs.com/news/709592/rivian-layoffs-2024/,https://cdn.motor1.com/images/mgl/3WvYQR/s6/rivian-ceo-rj-scaringe-driving-the-first-production-r1t-pickup-off-the-production-line-in-normal-illinois.jpg,Tim Levin,2024-02-21 22:47:19+00:00,,,,FALSE,2024-02-21 23:29:49.300296+00:00,,
29,eea920f7-c297-47b5-bb95-8a03735b8d0f,1,InsideEVs,https://insideevs.com/news/709517/rivian-r1t-r1s-video-playback-screen/,Rivian R1T And R1S Owners Figured Out How To Play Videos On The Central Display,"It’s not perfect, but it’s still better than nothing.","The Rivian R1T pickup and R1S SUV are some of the best $70,000+ EVs you can get right now, but they’re not perfect. They have a lot of bells and whistles, but even three years after the R1T went into production, Rivian hasn’t figured out a way to get streaming services like YouTube, Netlifx, or Amazon Prime on the EV’s main screen.",https://insideevs.com/news/709517/rivian-r1t-r1s-video-playback-screen/,https://cdn.motor1.com/images/mgl/eoRQ9M/s6/rivian-r1s-interior-with-your-video-here-text-on-the-center-screen.jpg,Iulian Dnistran,2024-02-21 20:00:28+00:00,,,,FALSE,2024-02-21 23:29:49.612610+00:00,,
30,1ca99c5a-d84d-4823-917b-96ced44fbd3b,1,InsideEVs,https://insideevs.com/news/709499/rivian-r2-tax-credit-ceo/,"The Rivian R2 Will Be Eligible For The $7,500 Tax Credit: CEO","RJ Scaringe said in an interview with Forbes that there’s a lack of choice in the EV space and that $48,000 is a pricing “sweet spot.”","The upcoming Rivian R2 EV, which will be unveiled on March 7, will be eligible for the full $7,500 tax credit, CEO RJ Scaringe said during an interview with Forbes. Currently, the all-electric R1S SUV and R1T pickup are eligible for a $3,750 tax credit when purchasing but only if the MSRP is under $80,000. Leasing, however, unlocks the full credit whatever the MSRP.",https://insideevs.com/news/709499/rivian-r2-tax-credit-ceo/,https://cdn.motor1.com/images/mgl/7ZvO8o/s6/rivian-r2-teaser.jpg,Iulian Dnistran,2024-02-21 18:00:17+00:00,,,,FALSE,2024-02-21 23:29:49.898517+00:00,,
31,0b37608a-56d1-4dcb-8e95-635dcc960ff3,1,InsideEVs,https://insideevs.com/features/709426/fisker-ocean-problems-customer-service/,Fisker Ocean Owners Love The Cars. Just Not The Bugs,"As complaints around quality problems and customer service pile up, some are losing patience. ","By the time Cory’s Fisker Ocean One arrived in October, he already had a bad feeling about the SUV. Problems with early owners’ cars and delays in receiving his own vehicle gave him pause, but he decided to take delivery anyway rather than lose his $5,000 deposit, he told InsideEVs. ",https://insideevs.com/features/709426/fisker-ocean-problems-customer-service/,https://cdn.motor1.com/images/mgl/MkvBl8/s6/fisker-loading-top.jpg,Tim Levin,2024-02-21 17:34:19+00:00,,,,FALSE,2024-02-21 23:29:50.199142+00:00,,
